{
  "schemaVersion": 1,
  "owner": "ui-router-maintainers",
  "bindings": {
    "baselinesSha256": "067aba9638577ece965e0ca7527e659ff6658dd97bb57c90ec9060fe2901ccd9",
    "packageClassificationSha256": "a8a069a2946c2e93f92121378d57857da4f038fac000e4f73ff4c465de320365",
    "sourceAliasesSha256": "9cd5ee9d7f562643132f93326f8bf88ff96dfb4b03291fb3827437517af2dd57",
    "packageArtifactsSha256": "c1a04916fd3d6904869a8dc9f0d4e8512fe4f959da7e79e039aab8a98f35589d",
    "integrationMatrixSha256": "982ccc82ba96f16aa35fa4a0f3ce319272bac9beb9d306419d356a9b42595821",
    "executionLockSha256": "c91e729ab343ffc652216dbcf9e4b8b3d650a6f1fecb8562dad7f419ba967aed",
    "packageLockSha256": "20af880a5aada78ea950e515adaffbf5ae67ac497b0755e4070cda676168b996",
    "turboSha256": "4986207ed3f2a393671625acbf4f8fa06947696379423e2c046e2d8e9093d4c7"
  },
  "workflow": {
    "path": ".github/workflows/ci.yml",
    "name": "CI",
    "runner": "ubuntu-24.04",
    "triggers": {
      "pullRequest": true,
      "pushBranches": ["main"]
    },
    "permissions": {
      "contents": "read"
    },
    "concurrency": {
      "group": "ci-${{ github.workflow }}-${{ github.ref }}",
      "cancelInProgress": true
    },
    "artifactRetentionDays": 7,
    "packageArtifactName": "packages-${{ github.sha }}",
    "aggregateJob": "required"
  },
  "runtime": {
    "migrationImageDigest": "sha256:56ab6ddaab798f0664b18448a1226bfa9e43aefaa90af280ff79d05c350a2ef8",
    "ciImage": "mcr.microsoft.com/playwright@sha256:c091b21d9fae78c76e85cd4356431e9b018402f172a214fc7d7a5e9a7e29d8ac",
    "ciImageDigest": "sha256:c091b21d9fae78c76e85cd4356431e9b018402f172a214fc7d7a5e9a7e29d8ac",
    "os": "Ubuntu 24.04",
    "architecture": "x64",
    "node": "24.19.0",
    "npm": "11.17.0",
    "turbo": "2.10.12",
    "environment": {
      "CI": "1",
      "HUSKY": "0",
      "LC_ALL": "C",
      "TZ": "UTC",
      "UV_INDEX_URL": "https://pypi.org/simple",
      "UV_CACHE_DIR": "/tmp/uirouter-ci-uv-cache",
      "PLAYWRIGHT_BROWSERS_PATH": "/ms-playwright",
      "CYPRESS_CACHE_FOLDER": "/root/.cache/Cypress",
      "CHROME_BIN": "/ms-playwright/chromium-1234/chrome-linux64/chrome"
    },
    "npmRegistryBootstrapCommand": [
      "node",
      "tools/bootstrap-ci-registry-tarballs.mjs"
    ],
    "uv": {
      "version": "0.11.26",
      "versionOutput": "uv 0.11.26 (x86_64-unknown-linux-gnu)",
      "archiveUrl": "https://github.com/astral-sh/uv/releases/download/0.11.26/uv-x86_64-unknown-linux-gnu.tar.gz",
      "archiveSha256": "6426a73c3837e6e2483ee344cbc00f36394d179afcba6183cb77437e67db4af0",
      "bootstrapCommand": ["node", "tools/bootstrap-ci-uv.mjs"]
    },
    "browser": {
      "package": "@playwright/test",
      "version": "1.62.1",
      "name": "chromium",
      "revision": "1234",
      "versionString": "151.0.7922.34",
      "executableSha256": "0b20b130e7edd9dd51873be867761295fe0cfad490c2b9a64f95bd3cfc08fa71"
    },
    "npmInstallCommand": [
      "npm",
      "install",
      "--global",
      "npm@11.17.0",
      "--ignore-scripts",
      "--no-audit",
      "--no-fund"
    ]
  },
  "actions": {
    "checkout": {
      "version": "v4.2.2",
      "sha": "11bd71901bbe5b1630ceea73d27597364c9af683"
    },
    "setupNode": {
      "version": "v4.4.0",
      "sha": "49933ea5288caeca8642d1e84afbd3f7d6820020"
    },
    "uploadArtifact": {
      "version": "v4.6.2",
      "sha": "ea165f8d65b6e75b540449e92b4886f43607fa02"
    },
    "downloadArtifact": {
      "version": "v4.3.0",
      "sha": "d3f86a106a0bac45b974a628896c90dbdf5c8093"
    }
  },
  "gateIds": [
    "history",
    "layout",
    "install",
    "dependency-policy",
    "static-quality",
    "source-linked-tests",
    "production-builds",
    "packed-consumers",
    "isolated-matrix",
    "workspace-browser",
    "docs"
  ],
  "jobs": [
    {
      "id": "contracts",
      "needs": [],
      "gateIds": [
        "history",
        "layout",
        "install",
        "dependency-policy",
        "static-quality"
      ],
      "timeoutMinutes": 90,
      "commands": [
        {
          "id": "runtime",
          "argv": ["node", "tools/verify-ci-runtime.mjs"],
          "timeoutMinutes": 2
        },
        {
          "id": "check-locks",
          "argv": ["npm", "run", "verify:locks"],
          "timeoutMinutes": 10
        },
        {
          "id": "check-layout",
          "argv": ["npm", "run", "verify:layout"],
          "timeoutMinutes": 10
        },
        {
          "id": "prove-installs",
          "argv": ["npm", "run", "prove:installs:ci"],
          "timeoutMinutes": 30
        },
        {
          "id": "install",
          "argv": ["npm", "ci", "--ignore-scripts", "--no-audit", "--no-fund"],
          "timeoutMinutes": 10
        },
        {
          "id": "check-static",
          "argv": ["npm", "run", "check:static:installed"],
          "timeoutMinutes": 20
        },
        {
          "id": "test-n04",
          "argv": ["npm", "run", "test:n04-validators"],
          "timeoutMinutes": 30
        },
        {
          "id": "test-n05",
          "argv": ["npm", "run", "test:n05-package-manager"],
          "timeoutMinutes": 30
        },
        {
          "id": "test-current-installs",
          "argv": ["npm", "run", "test:current-installs"],
          "timeoutMinutes": 10
        },
        {
          "id": "test-s01",
          "argv": ["npm", "run", "test:s01"],
          "timeoutMinutes": 30
        },
        {
          "id": "test-s02",
          "argv": ["npm", "run", "test:source-aliases"],
          "timeoutMinutes": 30
        },
        {
          "id": "test-s03",
          "argv": ["npm", "run", "test:turbo"],
          "timeoutMinutes": 30
        },
        {
          "id": "test-i01",
          "argv": ["npm", "run", "test:isolated"],
          "timeoutMinutes": 30
        },
        {
          "id": "test-p01",
          "argv": ["npm", "run", "test:package-artifacts"],
          "timeoutMinutes": 30
        },
        {
          "id": "test-i02",
          "argv": ["npm", "run", "test:integration-matrix"],
          "timeoutMinutes": 30
        },
        {
          "id": "test-c01",
          "argv": ["npm", "run", "test:ci-gates"],
          "timeoutMinutes": 30
        },
        {
          "id": "test-c02",
          "argv": ["npm", "run", "test:reproducibility"],
          "timeoutMinutes": 30
        },
        {
          "id": "test-a01",
          "argv": ["npm", "run", "test:acceptance"],
          "timeoutMinutes": 30
        },
        {
          "id": "test-history",
          "argv": ["npm", "run", "test:history-migration"],
          "timeoutMinutes": 30
        },
        {
          "id": "test-local-release",
          "argv": ["node", "--test", "tools/test-local-release.mjs"],
          "timeoutMinutes": 5
        }
      ],
      "failurePaths": [".ci-results/contracts/**"]
    },
    {
      "id": "source",
      "needs": [],
      "gateIds": ["static-quality", "source-linked-tests"],
      "timeoutMinutes": 90,
      "commands": [
        {
          "id": "runtime",
          "argv": ["node", "tools/verify-ci-runtime.mjs"],
          "timeoutMinutes": 2
        },
        {
          "id": "install",
          "argv": ["npm", "ci", "--ignore-scripts", "--no-audit", "--no-fund"],
          "timeoutMinutes": 10
        },
        {
          "id": "lint",
          "argv": [
            "npm",
            "run",
            "lint",
            "--",
            "--cache=local:"
          ],
          "timeoutMinutes": 30
        },
        {
          "id": "angularjs-lint-proof",
          "argv": [
            "node",
            "tools/verify-angularjs-lint.mjs",
            "--output",
            ".ci-results/source/angularjs-lint.json"
          ],
          "timeoutMinutes": 5
        },
        {
          "id": "typecheck",
          "argv": ["npm", "run", "typecheck", "--", "--cache=local:"],
          "timeoutMinutes": 30
        },
        {
          "id": "test",
          "argv": [
            "npm",
            "run",
            "test",
            "--",
            "--cache=local:",
            "--env-mode=loose"
          ],
          "timeoutMinutes": 30
        },
        {
          "id": "source-commands",
          "argv": ["npm", "run", "prove:source-commands"],
          "timeoutMinutes": 30
        },
        {
          "id": "source-watch",
          "argv": ["npm", "run", "prove:source-watch"],
          "timeoutMinutes": 30
        },
        {
          "id": "source-packs",
          "argv": ["npm", "run", "prove:source-packs"],
          "timeoutMinutes": 30
        }
      ],
      "failurePaths": [".ci-results/source/**"]
    },
    {
      "id": "packages",
      "needs": [],
      "gateIds": ["production-builds", "packed-consumers"],
      "timeoutMinutes": 90,
      "commands": [
        {
          "id": "runtime",
          "argv": ["node", "tools/verify-ci-runtime.mjs"],
          "timeoutMinutes": 2
        },
        {
          "id": "install",
          "argv": ["npm", "ci", "--ignore-scripts", "--no-audit", "--no-fund"],
          "timeoutMinutes": 10
        },
        {
          "id": "prove-packages",
          "argv": ["npm", "run", "prove:package-artifacts"],
          "timeoutMinutes": 30
        },
        {
          "id": "stage-packages",
          "argv": [
            "node",
            "tools/stage-ci-package-artifacts.mjs",
            "--output",
            ".ci-artifacts/packages"
          ],
          "timeoutMinutes": 30
        },
        {
          "id": "test-package-input",
          "argv": [
            "node",
            "tools/test-ci-package-input.mjs",
            "--input",
            ".ci-artifacts/packages"
          ],
          "timeoutMinutes": 10
        }
      ],
      "failurePaths": [
        ".ci-results/packages/**",
        ".migration-work/package-proof/**",
        ".ci-artifacts/packages/hashes.json"
      ]